<?xml version="1.0" encoding="utf-8"?>
<Project xmlns:xsi="http://www.w3.org/2001/XMLSchema-instance"
  xsi:noNamespaceSchemaLocation="XSD/V1/Project.xsd">

  <Name>My GUT NAME</Name>
  <ProjectType>GUT</ProjectType>

  <MetaData>
    <Meta Name="year">2012</Meta>
    <Meta Name="visit">1029</Meta>
  </MetaData>

  <!--Inputs are defined here so they can be used in Realizations-->
  <Inputs>
    <DEM id="DEM01" Guid="">
      <Name>DEM1</Name>
      <Path>CBW05583-028079/2012/VISIT_1029/Inputs/dem.img</Path>
    </DEM>
    <Raster id="DETDEM01" Guid="">
      <Name>Detrended DEM</Name>
      <Path>CBW05583-028079/2012/VISIT_1029/Inputs/detDEM.img</Path>
    </Raster>
    <Raster id="DEPTH01" Guid="">
      <Name>Water Depth</Name>
      <Path>CBW05583-028079/2012/VISIT_1029/Inputs/waterDepth.img</Path>
    </Raster>

    <HillShade id="HS01" Guid="">
      <Name>Hillshade</Name>
      <Path>CBW05583-028079/2012/VISIT_1029/Inputs/HS.img</Path>
    </HillShade>

    <Vector id="BFCL01" Guid="">
      <Name>Bankfull CenterLine</Name>
      <Path>CBW05583-028079/2012/VISIT_1029/Inputs/bfCL.shp</Path>
    </Vector>
    <Vector id="BFPOLY01" Guid="">
      <Name>Bankfull Polygon</Name>
      <Path>CBW05583-028079/2012/VISIT_1029/Inputs/bfPolygon.shp</Path>
    </Vector>
    <Vector id="BFXS01" Guid="">
      <Name>Bankfull Cross Sections</Name>
      <Path>CBW05583-028079/2012/VISIT_1029/Inputs/bfXS.shp</Path>
    </Vector>
    <Vector id="CHUNCLIP01" Guid="">
      <Name>Channel Units Clip</Name>
      <Path>CBW05583-028079/2012/VISIT_1029/Inputs/channelUnitsClip.shp</Path>
    </Vector>
    <Vector id="THALWEG01" Guid="">
      <Name>Thalweg</Name>
      <Path>CBW05583-028079/2012/VISIT_1029/Inputs/Thalweg.shp</Path>
    </Vector>
    <Vector id="WEPOLY01" Guid="">
      <Name>Wetted Polygon</Name>
      <Path>CBW05583-028079/2012/VISIT_1029/Inputs/wePoly.shp</Path>
    </Vector>


  </Inputs>

  <Realizations>
    <GUT DateCreated="" Guid="" ProductVersion="" Promoted="true">
      <Name>VISIT 1029 Realization 1</Name>

      <Parameters>
        <Param Name=""></Param>
      </Parameters>

      <!--In this case the inputs for this realization reference
      the ones defined at the top of the file. If there are any
      inputs specific to this realization they would be defined
      here instead of referencing them.-->
      <Inputs>
        <Raster ref="DEM01"/>
        <Raster ref="DETDEM01"/>
        <Raster ref="DEPTH01"/>
        <Raster ref="BFCL01"/>
        <Raster ref="BFPOLY01"/>
        <Raster ref="BFXS01"/>
        <Raster ref="CHUNCLIP01"/>
        <Raster ref="THALWEG01"/>
        <Raster ref="WETPOLY01"/>
      </Inputs>

      <Analysis>
        <Outputs>
          <InChannel>
            <Tier1>
              <Path>CBW05583-028079/2012/VISIT_1029/Output/Tier1_InChannel.shp</Path>
            </Tier1>
            <Tier2>
              <Path>CBW05583-028079/2012/VISIT_1029/Output/Tier2_InChannel.shp</Path>
            </Tier2>
            <Tier3>
              <Path>CBW05583-028079/2012/VISIT_1029/Output/Tier3_InChannel.shp</Path>
            </Tier3>
          </InChannel>
          <OutChannel>
            <Tier1>
              <Path>CBW05583-028079/2012/VISIT_1029/Output/Tier1_OutofChannel.shp</Path>
            </Tier1>
            <Tier2>
              <Path>CBW05583-028079/2012/VISIT_1029/Output/Tier2_OutofChannel.shp</Path>
            </Tier2>
            <Tier3>
              <Path>CBW05583-028079/2012/VISIT_1029/Output/Tier3_OutofChannel.shp</Path>
            </Tier3>
          </OutChannel>
        </Outputs>
      </Analysis>

    </GUT>
  </Realizations>
</Project>