<?xml version="1.0" encoding="utf-8"?>
<Project xmlns:xsi="http://www.w3.org/2001/XMLSchema-instance"
  xsi:noNamespaceSchemaLocation="XSD/v1/Project.xsd">

  <Name>My GUT NAME</Name>
  <ProjectType>GUT</ProjectType>

  <MetaData>
    <Meta Name="year">2012</Meta>
    <Meta Name="visit">1029</Meta>
  </MetaData>

    <!--Inputs are defined here so they can be used in Realizations-->
  <!-- Inputs must have unique Ids that can be referenced in realizations I'm keeping
    legible here so that it's readable in the realiations the GUID is to keep things unique-->
  <Inputs>
    <Raster id="DEPTH01" Guid="">
      <Name>Hydro Results: Depth</Name>
      <Path>CBW05583-028079/2012/VISIT_1029/Q_001/Inputs/HydroResults/Depth.tif</Path>
    </Raster>
    <Raster id="VELOCITY01" Guid="">
      <Name>Hydro Results: Velocity</Name>
      <Path>CBW05583-028079/2012/VISIT_1029/Q_001/Inputs/HydroResults/Velocity.tif</Path>
    </Raster>
    <Raster id="GRAINSIZE01" Guid="">
      <Name>Grainsize: D50</Name>
      <Path>CBW05583-028079/2012/VISIT_1029/Q_001/Inputs/GrainSize/D50.tif</Path>
    </Raster>
  </Inputs>

  <Realizations>
    <FHM Guid="" DateCreated="" ProductVersion="" Promoted="true">
      <Name>FHM Realization 01</Name>

      <Parameters>
        <Param Name="Param1">Param</Param>
      </Parameters>

      <Inputs>
        <Raster id="Depth">
          <InputRef>DEPTH01</InputRef>
        </Raster>
        <Raster id="Velocity">
          <InputRef>VELOCITY01</InputRef>
        </Raster>
        <Raster id="GrainSize">
          <InputRef>GRAINSIZE01</InputRef>
        </Raster>
      </Inputs>

      <Analyses>
        <Fuzzy>


        </Fuzzy>
        <HSI>

        </HSI>
      </Analyses>
    </FHM>
  </Realizations>

</Project>