<?xml version="1.0" encoding="utf-8"?>
<Project xmlns:xsi="http://www.w3.org/2001/XMLSchema-instance"
  xsi:noNamespaceSchemaLocation="XSD/v1/Project.xsd">

  <Name>CWB_0000001</Name>
  <ProjectType>NREI</ProjectType>

  <MetaData>
    <Meta Name="Year">2012</Meta>
    <Meta Name="Visit">1029</Meta>
    <Meta Name="Flow">Q001</Meta>
  </MetaData>

  <Inputs>
    <Raster id="Depth01" Guid="241cdf2a-a397-4fd7-acd2-de0869ed4662">
      <Name>Depth</Name>
      <Path>CWB_0000001/2012/1029/Q001/inputs/WaterDepth1.tif</Path>
    </Raster>
    <Raster id="Velocity01" Guid="241cdf2a-a397-4fd7-acd2-de0869ed4662">
      <Name>Velocity</Name>
      <Path>CWB_0000001/2012/1029/Q001/inputs/WaterVelocity1.tif</Path>
    </Raster>
  </Inputs>

  <Realizations>
    <Realization DateCreated="2016-07-08T23:49:51" ProductVersion="1.0.0" Guid="241cdf2a-a397-4fd7-acd2-de0869ed4662">

      <Name>Realization: 2012 Visit 1029 Flow Q001</Name>

      <Parameters>
        <Param Name="species">Steelhead</Param>
        <Param Name="size_mm">70</Param>
      </Parameters>

      <Inputs>
        <Raster>
          <InputRef>Depth01</InputRef>
          <MetaData>
            <Meta Name="ProgramLinkage">DEPTH</Meta>
          </MetaData>
        </Raster>
        <Raster>
          <InputRef>Velocity01</InputRef>
          <MetaData>
            <Meta Name="ProgramLinkage">VELOCITY</Meta>
          </MetaData>
        </Raster>
      </Inputs>

      <Analyses>
        <Analysis>
          <Name>My Analysis</Name>
          <Outputs>
            <Raster>
              <Name>NREI</Name>
              <Path>CWB_0000001/2012/1029/Q001/outputs/Steelhead/70mm/nrei.tif</Path>
            </Raster>
          </Outputs>
        </Analysis>
      </Analyses>

    </Realization>


  </Realizations>

</Project>
