<?xml version="1.0" encoding="utf-8" standalone="yes"?>
<Project xmlns:xsi="http://www.w3.org/2001/XMLSchema-instance"
  xsi:noNamespaceSchemaLocation="XSD/v1/Project.xsd">

  <Name>Someproject</Name>
  <ProjectType>SomeProject</ProjectType>

    <MetaData>
      <Meta Name="SomeKey">SomeVal</Meta>
    </MetaData>

    <Inputs>

      <!--HERE ARE SOME PROJECT LINK CASES WE NEED TO COVER-->

      <!--Case 1: Local file, non program vallye bottom file-->
      <Vector id="valleybottom01">
        <Name>USal_valley_bottom</Name>
        <Path>inputs\confinements\valley_bottom_polygon\valley_bottom_polygon_01\USal_valleybottom.shp</Path>
      </Vector>

      <!--Case 2: External project, local file not a program-->
      <Vector id="valleybottom01">
        <Name>USal_valley_bottom</Name>
        <ProjectLink>Sample_VBET_Project</ProjectLink>
        <Path>inputs\confinements\valley_bottom_polygon\valley_bottom_polygon_01\USal_valleybottom.shp</Path>
      </Vector>

     <!--Case 3: External program-->
      <VBET id="valleybottom01">
        <RelativePath>s3://something/soemthing/something/VBET/Sample_VBET_Project/vbet3.xml</RelativePath>
        <OutputNodeXPath>//Project/Realizations/VBET[@promoted='TRUE']/Analysis/Outputs/Vector[@id='ValleyBottom']</OutputNodeXPath>
        <OutputNodeGUID>241cdf2a-a397-4fd7-acd2-de0869ed4662</OutputNodeGUID>
      </VBET>




      <!--Context Layers-->
      <Vector id="ecoregions01" Guid="">
        <Name>Eco Regions</Name>
        <Path>analyses\context\layers\UpperSalmon_eco_L4.shp</Path>
      </Vector>
      <Vector id="watershedBoundary01" Guid="">
        <Name>Watershed Boundary</Name>
        <Path>analyses\context\layers\watershed_boundary\Upper_Salmon_ab_Redfish_Boundary.shp</Path>
      </Vector>
      <Vector id="hillshade01" Guid="">
        <Name>Hillshade</Name>
        <Path>analyses\context\layers\hillshade\Upper_Salmon_Hillshade.tif</Path>
      </Vector>
    </Inputs>


    <Realizations>
      <RiverStyles Promoted="1" DateCreated="" ProductVersion="" Guid="241cdf2a-a397-4fd7-acd2-de0869ed4662">
        <Name>USal_confinement_500m</Name>

        <Parameters>
          <Param Name="segmentation_distance">500</Param>
        </Parameters>

        <!--Inputs refer to the files defined at the top of the file-->
        <Inputs>
          <DrainageNetworks GUID="241cdf2a-a397-4fd7-acd2-de0869ed4662">
            <Network>
              <fileRef>drainageNetwork01</fileRef>
              <Buffers>
                <Buffer>
                  <fileRef>USal_500m</fileRef>
                </Buffer>
              </Buffers>
              <ValleyBottom>
                <fileRef>valleybottom01</fileRef>
              </ValleyBottom>
            </Network>
          </DrainageNetworks>
        </Inputs>

        <Analysis>
          <Confinements>
            <Confinement>
              <Name>USal_confinement_500m</Name>
              <Path>analyses\confinements\confinement_01\USal_Confinement_500m.shp</Path>
              <MetaData>
                <Meta Name="segmentation_distance">500</Meta>
              </MetaData>
            </Confinement>
          </Confinements>
          <RiverStyleReach>
            <ManualCrossChecks>
              <ManualCrossCheck>
                <Path>analyses\river_styles\manual_crosschecks\manual_crosscheck_01\USal_River_Styles.shp</Path>
              </ManualCrossCheck>
            </ManualCrossChecks>
          </RiverStyleReach>
        </Analysis>

      </RiverStyles>

    </Realizations>

</Project>